{
  "$schema": "https://json-schema.org/draft/2020-12/schema",
  "title": "seed/duplicate_candidates.json单条记录契约",
  "type": "object",
  "properties": {
    "approved_by": {
      "type": [
        "null",
        "string"
      ]
    },
    "candidate_ticket_id": {
      "type": "string"
    },
    "decision": {
      "type": "string"
    },
    "id": {
      "type": "string"
    },
    "is_synthetic": {
      "type": "boolean",
      "const": true
    },
    "match_reasons": {
      "type": "array",
      "items": {
        "type": "string"
      }
    },
    "similarity_score": {
      "type": "number"
    },
    "ticket_id": {
      "type": "string"
    }
  },
  "required": [
    "approved_by",
    "candidate_ticket_id",
    "decision",
    "id",
    "is_synthetic",
    "match_reasons",
    "similarity_score",
    "ticket_id"
  ],
  "additionalProperties": false
}
